title,type,question,A,B,C,D,E,F,answer,image
Methods of Contraception,checkbox,prevent ovulation / menghalang proses pengovulan,Contraceptive pills / Pil pencegah hamil,Implants / Implan,Use of condom / Penggunaan kondom,"Intrauterine Contraceptive Device, IUCD / Alat kontraseptif dalam uterus, IUCD",Vasectomy / Vasektomi,Ligation / Ligasi,"A,B",
,radio,"to prevent the sperm from entering the vagina during ejaculation / 
menghalang sperma daripada memasuki faraj semasa ejakulasi.",Contraceptive pills / Pil pencegah hamil,Implants / Implan,Use of condom / Penggunaan kondom,"Intrauterine Contraceptive Device, IUCD / Alat kontraseptif dalam uterus, IUCD",Vasectomy / Vasektomi,Ligation / Ligasi,C,
,radio,to prevent implantation / mengelakkan penempelan,Contraceptive pills / Pil pencegah hamil,Implants / Implan,Use of condom / Penggunaan kondom,"Intrauterine Contraceptive Device, IUCD / Alat kontraseptif dalam uterus, IUCD",Vasectomy / Vasektomi,Ligation / Ligasi,D,
,radio,"to prevent the sperms from being transported to the urethra / 
tiada sperma yang dipancutkan semasa ejakulasi",Contraceptive pills / Pil pencegah hamil,Implants / Implan,Use of condom / Penggunaan kondom,"Intrauterine Contraceptive Device, IUCD / Alat kontraseptif dalam uterus, IUCD",Vasectomy / Vasektomi,Ligation / Ligasi,E,
,radio,"to prevent the ovum from being transported to the uterus / 
untuk mengelakkan ovum daripada diangkut ke uterus",Contraceptive pills / Pil pencegah hamil,Implants / Implan,Use of condom / Penggunaan kondom,"Intrauterine Contraceptive Device, IUCD / Alat kontraseptif dalam uterus, IUCD",Vasectomy / Vasektomi,Ligation / Ligasi,F,
